,year_film,year_ceremony,ceremony,category,name,film,winner,tmdb_id
5386,1999,2000,72,BEST SONG,Music and Lyric by Trey Parker and Marc Shaiman,"South Park: Bigger, Longer & Uncut",False,9473.0
5387,1999,2000,72,BEST SONG,Music and Lyric by Diane Warren,Music of the Heart,False,26149.0
5388,1999,2000,72,BEST SONG,Music and Lyric by Aimee Mann,Magnolia,False,334.0
5389,1999,2000,72,BEST SONG,Music and Lyric by Randy Newman,Toy Story 2,False,863.0
5390,1999,2000,72,BEST SONG,Music and Lyric by Phil Collins,Tarzan,True,37135.0
5391,1999,2000,72,BEST PICTURE,"Bruce Cohen and Dan Jinks, Producers",American Beauty,True,14.0
5392,1999,2000,72,BEST PICTURE,"Richard N. Gladstein, Producer",The Cider House Rules,False,1715.0
5393,1999,2000,72,BEST PICTURE,"David Valdes and Frank Darabont, Producers",The Green Mile,False,497.0
5394,1999,2000,72,BEST PICTURE,"Michael Mann and Pieter Jan Brugge, Producers",The Insider,False,9008.0
5395,1999,2000,72,BEST PICTURE,"Frank Marshall, Kathleen Kennedy and Barry Mendel, Producers",The Sixth Sense,False,745.0
5396,1999,2000,72,BEST SOUND,"Robert J. Litt, Elliot Tyson, Michael Herbick, Willie D. Burton",The Green Mile,False,497.0
5397,1999,2000,72,BEST SOUND,"Andy Nelson, Doug Hemphill, Lee Orloff",The Insider,False,9008.0
5398,1999,2000,72,BEST SOUND,"John Reitz, Gregg Rudloff, David Campbell, David Lee",The Matrix,True,603.0
5399,1999,2000,72,BEST SOUND,"Leslie Shatz, Chris Carpenter, Rick Kline, Chris Munro",The Mummy,False,564.0
5400,1999,2000,72,BEST SOUND,"Gary Rydstrom, Tom Johnson, Shawn Murphy, John Midgley",Star Wars Episode I: The Phantom Menace,False,1893.0
5401,1999,2000,72,BEST SOUND,"Ren Klyce, Richard Hymns",Fight Club,False,550.0
5402,1999,2000,72,BEST SOUND,Dane A. Davis,The Matrix,True,603.0
5403,1999,2000,72,BEST SOUND,"Ben Burtt, Tom Bellfort",Star Wars Episode I: The Phantom Menace,False,1893.0
5404,1999,2000,72,VISUAL EFFECTS,"John Gaeta, Janek Sirrs, Steve Courtley, Jon Thum",The Matrix,True,603.0
5405,1999,2000,72,VISUAL EFFECTS,"John Knoll, Dennis Muren, Scott Squires, Rob Coleman",Star Wars Episode I: The Phantom Menace,False,1893.0
5406,1999,2000,72,VISUAL EFFECTS,"John Dykstra, Jerome Chen, Henry F. Anderson III, Eric Allard",Stuart Little,False,10137.0
5407,1999,2000,72,ADAPTED SCREENPLAY,John Irving,The Cider House Rules,True,1715.0
5408,1999,2000,72,ADAPTED SCREENPLAY,"Alexander Payne, Jim Taylor",Election,False,9451.0
5409,1999,2000,72,ADAPTED SCREENPLAY,Frank Darabont,The Green Mile,False,497.0
5410,1999,2000,72,ADAPTED SCREENPLAY,"Eric Roth, Michael Mann",The Insider,False,9008.0
5411,1999,2000,72,ADAPTED SCREENPLAY,Anthony Minghella,The Talented Mr. Ripley,False,1213.0
5412,1999,2000,72,SPECIAL AWARD, Andrzej Wajda in recognition of five decades of extraordinary film direction.,,True,
5413,1999,2000,72,SPECIAL AWARD,Warren Beatty,,True,
5414,2000,2001,73,ACTOR,Javier Bardem,Before Night Falls,False,5001.0
5415,2000,2001,73,ACTOR,Russell Crowe,Gladiator,True,98.0
5416,2000,2001,73,ACTOR,Tom Hanks,Cast Away,False,8358.0
5417,2000,2001,73,ACTOR,Ed Harris,Pollock,False,12509.0
5418,2000,2001,73,ACTOR,Geoffrey Rush,Quills,False,10876.0
5419,2000,2001,73,ACTOR IN A SUPPORTING ROLE,Jeff Bridges,The Contender,False,6521.0
5420,2000,2001,73,ACTOR IN A SUPPORTING ROLE,Willem Dafoe,Shadow of the Vampire,False,10873.0
5421,2000,2001,73,ACTOR IN A SUPPORTING ROLE,Benicio Del Toro,Traffic,True,1900.0
5422,2000,2001,73,ACTOR IN A SUPPORTING ROLE,Albert Finney,Erin Brockovich,False,462.0
5423,2000,2001,73,ACTOR IN A SUPPORTING ROLE,Joaquin Phoenix,Gladiator,False,98.0
5424,2000,2001,73,ACTRESS,Joan Allen,The Contender,False,6521.0
5425,2000,2001,73,ACTRESS,Juliette Binoche,Chocolat,False,392.0
5426,2000,2001,73,ACTRESS,Ellen Burstyn,Requiem for a Dream,False,641.0
5427,2000,2001,73,ACTRESS,Laura Linney,You Can Count on Me,False,14295.0
5428,2000,2001,73,ACTRESS,Julia Roberts,Erin Brockovich,True,462.0
5429,2000,2001,73,ACTRESS IN A SUPPORTING ROLE,Judi Dench,Chocolat,False,392.0
5430,2000,2001,73,ACTRESS IN A SUPPORTING ROLE,Marcia Gay Harden,Pollock,True,12509.0
5431,2000,2001,73,ACTRESS IN A SUPPORTING ROLE,Kate Hudson,Almost Famous,False,786.0
5432,2000,2001,73,ACTRESS IN A SUPPORTING ROLE,Frances McDormand,Almost Famous,False,786.0
5433,2000,2001,73,ACTRESS IN A SUPPORTING ROLE,Julie Walters,Billy Elliot,False,71.0
5434,2000,2001,73,BEST PRODUCTION DESIGN,Tim Yip,"Crouching Tiger, Hidden Dragon",True,146.0
5435,2000,2001,73,BEST PRODUCTION DESIGN,Art Direction:  Michael Corenblith;  Set Decoration:  Merideth Boswell,Dr. Seuss' How the Grinch Stole Christmas,False,8871.0
5436,2000,2001,73,BEST PRODUCTION DESIGN,Art Direction:  Arthur Max;  Set Decoration:  Crispian Sallis,Gladiator,False,98.0
5437,2000,2001,73,BEST PRODUCTION DESIGN,Art Direction:  Martin Childs;  Set Decoration:  Jill Quertier,Quills,False,10876.0
5438,2000,2001,73,BEST PRODUCTION DESIGN,Art Direction:  Jean Rabasse;  Set Decoration:  Françoise Benoît-Fresco,Vatel,False,7093.0
5439,2000,2001,73,CINEMATOGRAPHY,Peter Pau,"Crouching Tiger, Hidden Dragon",True,146.0
5440,2000,2001,73,CINEMATOGRAPHY,John Mathieson,Gladiator,False,98.0
5441,2000,2001,73,CINEMATOGRAPHY,Lajos Koltai,Malèna,False,10867.0
5442,2000,2001,73,CINEMATOGRAPHY,Roger Deakins,"O Brother, Where Art Thou?",False,134.0
5443,2000,2001,73,CINEMATOGRAPHY,Caleb Deschanel,The Patriot,False,2024.0
5444,2000,2001,73,COSTUME DESIGN,Tim Yip,"Crouching Tiger, Hidden Dragon",False,146.0
5445,2000,2001,73,COSTUME DESIGN,Rita Ryack,Dr. Seuss' How the Grinch Stole Christmas,False,8871.0
5446,2000,2001,73,COSTUME DESIGN,Janty Yates,Gladiator,True,98.0
5447,2000,2001,73,COSTUME DESIGN,Anthony Powell,102 Dalmatians,False,10481.0
5448,2000,2001,73,COSTUME DESIGN,Jacqueline West,Quills,False,10876.0
5449,2000,2001,73,BEST DIRECTOR,Stephen Daldry,Billy Elliot,False,71.0
5450,2000,2001,73,BEST DIRECTOR,Ang Lee,"Crouching Tiger, Hidden Dragon",False,146.0
5451,2000,2001,73,BEST DIRECTOR,Steven Soderbergh,Erin Brockovich,False,462.0
5452,2000,2001,73,BEST DIRECTOR,Ridley Scott,Gladiator,False,98.0
5453,2000,2001,73,BEST DIRECTOR,Steven Soderbergh,Traffic,True,1900.0
5454,2000,2001,73,FILM EDITING,"Joe Hutshing, Saar Klein",Almost Famous,False,786.0
5455,2000,2001,73,FILM EDITING,Tim Squyres,"Crouching Tiger, Hidden Dragon",False,146.0
5456,2000,2001,73,FILM EDITING,Pietro Scalia,Gladiator,False,98.0
5457,2000,2001,73,FILM EDITING,Stephen Mirrione,Traffic,True,1900.0
5458,2000,2001,73,FILM EDITING,Dede Allen,Wonder Boys,False,11004.0
5459,2000,2001,73,FOREIGN FILM,Mexico,Amores Perros,False,55.0
5460,2000,2001,73,FOREIGN FILM,Taiwan,"Crouching Tiger, Hidden Dragon",True,146.0
5461,2000,2001,73,FOREIGN FILM,Czech Republic,Divided We Fall,False,29937.0
5462,2000,2001,73,FOREIGN FILM,Belgium,Everybody Famous!,False,58886.0
5463,2000,2001,73,FOREIGN FILM,France,The Taste of Others,False,10697.0
5464,2000,2001,73,MAKEUP AND HAIRSTYLING,"Michèle Burke, Edouard Henriques",The Cell,False,8843.0
5465,2000,2001,73,MAKEUP AND HAIRSTYLING,"Rick Baker, Gail Ryan",Dr. Seuss' How the Grinch Stole Christmas,True,8871.0
5466,2000,2001,73,MAKEUP AND HAIRSTYLING,"Ann Buchanan, Amber Sibley",Shadow of the Vampire,False,10873.0
5467,2000,2001,73,BEST SCORE,Rachel Portman,Chocolat,False,392.0
5468,2000,2001,73,BEST SCORE,Tan Dun,"Crouching Tiger, Hidden Dragon",True,146.0
5469,2000,2001,73,BEST SCORE,Hans Zimmer,Gladiator,False,98.0
5470,2000,2001,73,BEST SCORE,Ennio Morricone,Malèna,False,10867.0
5471,2000,2001,73,BEST SCORE,John Williams,The Patriot,False,2024.0
5472,2000,2001,73,BEST SONG,Music and Lyric by Randy Newman,Meet the Parents,False,1597.0
5473,2000,2001,73,BEST SONG,Music by Björk; Lyric by Lars von Trier and Sjon Sigurdsson,Dancer in the Dark,False,16.0
5474,2000,2001,73,BEST SONG,Music by Jorge Calandrelli and Tan Dun; Lyric by James Schamus,"Crouching Tiger, Hidden Dragon",False,146.0
5475,2000,2001,73,BEST SONG,Music by Sting and David Hartley; Lyric by Sting,The Emperor's New Groove,False,11688.0
5476,2000,2001,73,BEST SONG,Music and Lyric by Bob Dylan,Wonder Boys,True,11004.0
5477,2000,2001,73,BEST PICTURE,"David Brown, Kit Golden and Leslie Holleran, Producers",Chocolat,False,392.0
5478,2000,2001,73,BEST PICTURE,"Bill Kong, Hsu Li Kong and Ang Lee, Producers","Crouching Tiger, Hidden Dragon",False,146.0
5479,2000,2001,73,BEST PICTURE,"Danny DeVito, Michael Shamberg and Stacey Sher, Producers",Erin Brockovich,False,462.0
5480,2000,2001,73,BEST PICTURE,"Douglas Wick, David Franzoni and Branko Lustig, Producers",Gladiator,True,98.0
5481,2000,2001,73,BEST PICTURE,"Edward Zwick, Marshall Herskovitz and Laura Bickford, Producers",Traffic,False,1900.0
5482,2000,2001,73,BEST SOUND,"Randy Thom, Tom Johnson, Dennis Sands, William B. Kaplan",Cast Away,False,8358.0
5483,2000,2001,73,BEST SOUND,"Scott Millan, Bob Beemer, Ken Weston",Gladiator,True,98.0
5484,2000,2001,73,BEST SOUND,"Kevin O'Connell, Greg P. Russell, Lee Orloff",The Patriot,False,2024.0
5485,2000,2001,73,BEST SOUND,"John Reitz, Gregg Rudloff, David Campbell, Keith A. Wester",The Perfect Storm,False,2133.0
5486,2000,2001,73,BEST SOUND,"Steve Maslow, Gregg Landaker, Rick Kline, Ivan Sharrock",U-571,False,3536.0
5487,2000,2001,73,BEST SOUND,"Alan Robert Murray, Bub Asman",Space Cowboys,False,5551.0
5488,2000,2001,73,BEST SOUND,Jon Johnson,U-571,True,3536.0
5489,2000,2001,73,VISUAL EFFECTS,"John Nelson, Neil Corbould, Tim Burke, Rob Harvey",Gladiator,True,98.0
5490,2000,2001,73,VISUAL EFFECTS,"Scott E. Anderson, Craig Hayes, Scott Stokdyk, Stan Parks",Hollow Man,False,9383.0
5491,2000,2001,73,VISUAL EFFECTS,"Stefen Fangmeier, Habib Zargarpour, John Frazier, Walt Conti",The Perfect Storm,False,2133.0
5492,2000,2001,73,ADAPTED SCREENPLAY,Screenplay by Robert Nelson Jacobs,Chocolat,False,392.0
5493,2000,2001,73,ADAPTED SCREENPLAY,Written by Wang Hui Ling and James Schamus and Tsai Kuo Jung,"Crouching Tiger, Hidden Dragon",False,146.0
5494,2000,2001,73,ADAPTED SCREENPLAY,Written by Ethan Coen & Joel Coen,"O Brother, Where Art Thou?",False,134.0
5495,2000,2001,73,ADAPTED SCREENPLAY,Screenplay by Stephen Gaghan,Traffic,True,1900.0
5496,2000,2001,73,ADAPTED SCREENPLAY,Screenplay by Steve Kloves,Wonder Boys,False,11004.0
5497,2000,2001,73,SPECIAL AWARD, Jack Cardiff,,True,
5498,2000,2001,73,SPECIAL AWARD, Ernest Lehman,,True,
5499,2000,2001,73,SPECIAL AWARD,Dino De Laurentiis,,True,
5500,2001,2002,74,ACTOR,Russell Crowe,A Beautiful Mind,False,453.0
5501,2001,2002,74,ACTOR,Sean Penn,I Am Sam,False,10950.0
5502,2001,2002,74,ACTOR,Will Smith,Ali,False,8489.0
5503,2001,2002,74,ACTOR,Denzel Washington,Training Day,True,2034.0
5504,2001,2002,74,ACTOR,Tom Wilkinson,In the Bedroom,False,1999.0
5505,2001,2002,74,ACTOR IN A SUPPORTING ROLE,Jim Broadbent,Iris,True,11889.0
5506,2001,2002,74,ACTOR IN A SUPPORTING ROLE,Ethan Hawke,Training Day,False,2034.0
5507,2001,2002,74,ACTOR IN A SUPPORTING ROLE,Ben Kingsley,Sexy Beast,False,11826.0
5508,2001,2002,74,ACTOR IN A SUPPORTING ROLE,Ian McKellen,The Lord of the Rings: The Fellowship of the Ring,False,120.0
5509,2001,2002,74,ACTOR IN A SUPPORTING ROLE,Jon Voight,Ali,False,8489.0
5510,2001,2002,74,ACTRESS,Halle Berry,Monster's Ball,True,1365.0
5511,2001,2002,74,ACTRESS,Judi Dench,Iris,False,11889.0
5512,2001,2002,74,ACTRESS,Nicole Kidman,Moulin Rouge,False,824.0
5513,2001,2002,74,ACTRESS,Sissy Spacek,In the Bedroom,False,1999.0
5514,2001,2002,74,ACTRESS,Renée Zellweger,Bridget Jones's Diary,False,634.0
5515,2001,2002,74,ACTRESS IN A SUPPORTING ROLE,Jennifer Connelly,A Beautiful Mind,True,453.0
5516,2001,2002,74,ACTRESS IN A SUPPORTING ROLE,Helen Mirren,Gosford Park,False,5279.0
5517,2001,2002,74,ACTRESS IN A SUPPORTING ROLE,Maggie Smith,Gosford Park,False,5279.0
5518,2001,2002,74,ACTRESS IN A SUPPORTING ROLE,Marisa Tomei,In the Bedroom,False,1999.0
5519,2001,2002,74,ACTRESS IN A SUPPORTING ROLE,Kate Winslet,Iris,False,11889.0
5520,2001,2002,74,ANIMATED FEATURE FILM,"Steve Oedekerk, John A. Davis",Jimmy Neutron: Boy Genius,False,12589.0
5521,2001,2002,74,ANIMATED FEATURE FILM,"Pete Docter, John Lasseter","Monsters, Inc.",False,585.0
5522,2001,2002,74,ANIMATED FEATURE FILM,Aron Warner,Shrek,True,808.0
5523,2001,2002,74,BEST PRODUCTION DESIGN,Art Direction:  Aline Bonetto; Set Decoration:  Marie-Laure Valla,Amélie,False,194.0
5524,2001,2002,74,BEST PRODUCTION DESIGN,Art Direction:  Stephen Altman; Set Decoration:  Anna Pinnock,Gosford Park,False,5279.0
5525,2001,2002,74,BEST PRODUCTION DESIGN,Art Direction:  Stuart Craig; Set Decoration:  Stephenie McMillan,Harry Potter and the Sorcerer's Stone,False,671.0
5526,2001,2002,74,BEST PRODUCTION DESIGN,Art Direction:  Grant Major; Set Decoration:  Dan Hennah,The Lord of the Rings: The Fellowship of the Ring,False,120.0
5527,2001,2002,74,BEST PRODUCTION DESIGN,Art Direction:  Catherine Martin; Set Decoration:  Brigitte Broch,Moulin Rouge,True,824.0
5528,2001,2002,74,CINEMATOGRAPHY,Bruno Delbonnel,Amélie,False,194.0
5529,2001,2002,74,CINEMATOGRAPHY,Slawomir Idziak,Black Hawk Down,False,855.0
5530,2001,2002,74,CINEMATOGRAPHY,Andrew Lesnie,The Lord of the Rings: The Fellowship of the Ring,True,120.0
5531,2001,2002,74,CINEMATOGRAPHY,Roger Deakins,The Man Who Wasn't There,False,10778.0
5532,2001,2002,74,CINEMATOGRAPHY,Donald M. McAlpine,Moulin Rouge,False,824.0
5533,2001,2002,74,COSTUME DESIGN,Milena Canonero,The Affair of the Necklace,False,19076.0
5534,2001,2002,74,COSTUME DESIGN,Jenny Beavan,Gosford Park,False,5279.0
5535,2001,2002,74,COSTUME DESIGN,Judianna Makovsky,Harry Potter and the Sorcerer's Stone,False,671.0
5536,2001,2002,74,COSTUME DESIGN,"Ngila Dickson, Richard Taylor",The Lord of the Rings: The Fellowship of the Ring,False,120.0
5537,2001,2002,74,COSTUME DESIGN,"Catherine Martin, Angus Strathie",Moulin Rouge,True,824.0
5538,2001,2002,74,BEST DIRECTOR,Ron Howard,A Beautiful Mind,True,453.0
5539,2001,2002,74,BEST DIRECTOR,Ridley Scott,Black Hawk Down,False,855.0
5540,2001,2002,74,BEST DIRECTOR,Robert Altman,Gosford Park,False,5279.0
5541,2001,2002,74,BEST DIRECTOR,Peter Jackson,The Lord of the Rings: The Fellowship of the Ring,False,120.0
5542,2001,2002,74,BEST DIRECTOR,David Lynch,Mulholland Drive,False,1018.0
5543,2001,2002,74,FILM EDITING,"Mike Hill, Dan Hanley",A Beautiful Mind,False,453.0
5544,2001,2002,74,FILM EDITING,Pietro Scalia,Black Hawk Down,True,855.0
5545,2001,2002,74,FILM EDITING,John Gilbert,The Lord of the Rings: The Fellowship of the Ring,False,120.0
5546,2001,2002,74,FILM EDITING,Dody Dorn,Memento,False,77.0
5547,2001,2002,74,FILM EDITING,Jill Bilcock,Moulin Rouge,False,824.0
5548,2001,2002,74,FOREIGN FILM,France,Amélie,False,194.0
5549,2001,2002,74,FOREIGN FILM,Norway,Elling,False,6007.0
5550,2001,2002,74,FOREIGN FILM,India,Lagaan,False,19666.0
5551,2001,2002,74,FOREIGN FILM,Bosnia & Herzegovina,No Man's Land,True,8342.0
5552,2001,2002,74,FOREIGN FILM,Argentina,Son of the Bride,False,19460.0
5553,2001,2002,74,MAKEUP AND HAIRSTYLING,"Greg Cannom, Colleen Callaghan",A Beautiful Mind,False,453.0
5554,2001,2002,74,MAKEUP AND HAIRSTYLING,"Peter Owen, Richard Taylor",The Lord of the Rings: The Fellowship of the Ring,True,120.0
5555,2001,2002,74,MAKEUP AND HAIRSTYLING,"Maurizio Silvi, Aldo Signoretti",Moulin Rouge,False,824.0
5556,2001,2002,74,BEST SCORE,John Williams,A.I. Artificial Intelligence,False,644.0
5557,2001,2002,74,BEST SCORE,James Horner,A Beautiful Mind,False,453.0
5558,2001,2002,74,BEST SCORE,John Williams,Harry Potter and the Sorcerer's Stone,False,671.0
5559,2001,2002,74,BEST SCORE,Howard Shore,The Lord of the Rings: The Fellowship of the Ring,True,120.0
5560,2001,2002,74,BEST SCORE,Randy Newman,"Monsters, Inc.",False,585.0
5561,2001,2002,74,BEST SONG,Music and Lyric by Randy Newman,"Monsters, Inc.",True,585.0
5562,2001,2002,74,BEST SONG,"Music and Lyric by Enya, Nicky Ryan and Roma Ryan",The Lord of the Rings: The Fellowship of the Ring,False,120.0
5563,2001,2002,74,BEST SONG,Music and Lyric by Diane Warren,Pearl Harbor,False,676.0
5564,2001,2002,74,BEST SONG,Music and Lyric by Sting,Kate & Leopold,False,11232.0
5565,2001,2002,74,BEST SONG,Music and Lyric by Paul McCartney,Vanilla Sky,False,1903.0
5566,2001,2002,74,BEST PICTURE,"Brian Grazer and Ron Howard, Producers",A Beautiful Mind,True,453.0
5567,2001,2002,74,BEST PICTURE,"Robert Altman, Bob Balaban and David Levy, Producers",Gosford Park,False,5279.0
5568,2001,2002,74,BEST PICTURE,"Graham Leader, Ross Katz and Todd Field, Producers",In the Bedroom,False,1999.0
5569,2001,2002,74,BEST PICTURE,"Peter Jackson, Fran Walsh and Barrie M. Osborne, Producers",The Lord of the Rings: The Fellowship of the Ring,False,120.0
5570,2001,2002,74,BEST PICTURE,"Martin Brown, Baz Luhrmann and Fred Baron, Producers",Moulin Rouge,False,824.0
5571,2001,2002,74,BEST SOUND,"Vincent Arnardi, Guillaume Leriche, Jean Umansky",Amélie,False,194.0
5572,2001,2002,74,BEST SOUND,"Michael Minkler, Myron Nettinga, Chris Munro",Black Hawk Down,True,855.0
5573,2001,2002,74,BEST SOUND,"Christopher Boyes, Michael Semanick, Gethin Creagh, Hammond Peek",The Lord of the Rings: The Fellowship of the Ring,False,120.0
5574,2001,2002,74,BEST SOUND,"Andy Nelson, Anna Behlmer, Roger Savage, Guntis Sics",Moulin Rouge,False,824.0
5575,2001,2002,74,BEST SOUND,"Kevin O'Connell, Greg P. Russell, Peter J. Devlin",Pearl Harbor,False,676.0
5576,2001,2002,74,BEST SOUND,"Gary Rydstrom, Michael Silvers","Monsters, Inc.",False,585.0
5577,2001,2002,74,BEST SOUND,"George Watters II, Christopher Boyes",Pearl Harbor,True,676.0
5578,2001,2002,74,VISUAL EFFECTS,"Dennis Muren, Scott Farrar, Stan Winston, Michael Lantieri",A.I. Artificial Intelligence,False,644.0
5579,2001,2002,74,VISUAL EFFECTS,"Jim Rygiel, Randall William Cook, Richard Taylor, Mark Stetson",The Lord of the Rings: The Fellowship of the Ring,True,120.0
5580,2001,2002,74,VISUAL EFFECTS,"Eric Brevig, John Frazier, Ed Hirsh, Ben Snow",Pearl Harbor,False,676.0
5581,2001,2002,74,ADAPTED SCREENPLAY,Written by Akiva Goldsman,A Beautiful Mind,True,453.0
5582,2001,2002,74,ADAPTED SCREENPLAY,Written by Daniel Clowes & Terry Zwigoff,Ghost World,False,1548.0
5583,2001,2002,74,ADAPTED SCREENPLAY,Screenplay by Rob Festinger and Todd Field,In the Bedroom,False,1999.0
5584,2001,2002,74,ADAPTED SCREENPLAY,"Screenplay by Fran Walsh, Philippa Boyens, Peter Jackson",The Lord of the Rings: The Fellowship of the Ring,False,120.0
5585,2001,2002,74,ADAPTED SCREENPLAY,Written by Ted Elliott & Terry Rossio and Joe Stillman and Roger S.H. Schulman,Shrek,False,808.0
5586,2001,2002,74,SPECIAL AWARD,Arthur Hiller,,True,
5587,2001,2002,74,SPECIAL AWARD, Sidney Poitier in recognition of his remarkable accomplishments as an artist and as a human being.,,True,
5588,2001,2002,74,SPECIAL AWARD, Robert Redford:  Actor,,True,
5589,2002,2003,75,ACTOR,Adrien Brody,The Pianist,True,423.0
5590,2002,2003,75,ACTOR,Nicolas Cage,Adaptation,False,2757.0
5591,2002,2003,75,ACTOR,Michael Caine,The Quiet American,False,8198.0
5592,2002,2003,75,ACTOR,Daniel Day-Lewis,Gangs of New York,False,3131.0
5593,2002,2003,75,ACTOR,Jack Nicholson,About Schmidt,False,2755.0
5594,2002,2003,75,ACTOR IN A SUPPORTING ROLE,Chris Cooper,Adaptation,True,2757.0
5595,2002,2003,75,ACTOR IN A SUPPORTING ROLE,Ed Harris,The Hours,False,590.0
5596,2002,2003,75,ACTOR IN A SUPPORTING ROLE,Paul Newman,Road to Perdition,False,4147.0
5597,2002,2003,75,ACTOR IN A SUPPORTING ROLE,John C. Reilly,Chicago,False,1574.0
5598,2002,2003,75,ACTOR IN A SUPPORTING ROLE,Christopher Walken,Catch Me If You Can,False,640.0
5599,2002,2003,75,ACTRESS,Salma Hayek,Frida,False,1360.0
5600,2002,2003,75,ACTRESS,Nicole Kidman,The Hours,True,590.0
5601,2002,2003,75,ACTRESS,Diane Lane,Unfaithful,False,2251.0
5602,2002,2003,75,ACTRESS,Julianne Moore,Far from Heaven,False,10712.0
5603,2002,2003,75,ACTRESS,Renée Zellweger,Chicago,False,1574.0
5604,2002,2003,75,ACTRESS IN A SUPPORTING ROLE,Kathy Bates,About Schmidt,False,2755.0
5605,2002,2003,75,ACTRESS IN A SUPPORTING ROLE,Julianne Moore,The Hours,False,590.0
5606,2002,2003,75,ACTRESS IN A SUPPORTING ROLE,Queen Latifah,Chicago,False,1574.0
5607,2002,2003,75,ACTRESS IN A SUPPORTING ROLE,Meryl Streep,Adaptation,False,2757.0
5608,2002,2003,75,ACTRESS IN A SUPPORTING ROLE,Catherine Zeta-Jones,Chicago,True,1574.0
5609,2002,2003,75,ANIMATED FEATURE FILM,Chris Wedge,Ice Age,False,425.0
5610,2002,2003,75,ANIMATED FEATURE FILM,Chris Sanders,Lilo & Stitch,False,11544.0
5611,2002,2003,75,ANIMATED FEATURE FILM,Jeffrey Katzenberg,Spirit: Stallion of the Cimarron,False,9023.0
5612,2002,2003,75,ANIMATED FEATURE FILM,Hayao Miyazaki,Spirited Away,True,129.0
5613,2002,2003,75,ANIMATED FEATURE FILM,Ron Clements,Treasure Planet,False,9016.0
5614,2002,2003,75,BEST PRODUCTION DESIGN,Art Direction:  John Myhre; Set Decoration:  Gordon Sim,Chicago,True,1574.0
5615,2002,2003,75,BEST PRODUCTION DESIGN,Art Direction:  Felipe Fernandez del Paso; Set Decoration:  Hania Robledo,Frida,False,1360.0
5616,2002,2003,75,BEST PRODUCTION DESIGN,Art Direction:  Dante Ferretti; Set Decoration:  Francesca Lo Schiavo,Gangs of New York,False,3131.0
5617,2002,2003,75,BEST PRODUCTION DESIGN,Art Direction:  Grant Major; Set Decoration:  Dan Hennah and Alan Lee,The Lord of the Rings: The Two Towers,False,121.0
5618,2002,2003,75,BEST PRODUCTION DESIGN,Art Direction:  Dennis Gassner; Set Decoration:  Nancy Haigh,Road to Perdition,False,4147.0
5619,2002,2003,75,CINEMATOGRAPHY,Dion Beebe,Chicago,False,1574.0
5620,2002,2003,75,CINEMATOGRAPHY,Edward Lachman,Far from Heaven,False,10712.0
5621,2002,2003,75,CINEMATOGRAPHY,Michael Ballhaus,Gangs of New York,False,3131.0
5622,2002,2003,75,CINEMATOGRAPHY,Pawel Edelman,The Pianist,False,423.0
5623,2002,2003,75,CINEMATOGRAPHY,Conrad L. Hall,Road to Perdition,True,4147.0
5624,2002,2003,75,COSTUME DESIGN,Colleen Atwood,Chicago,True,1574.0
5625,2002,2003,75,COSTUME DESIGN,Julie Weiss,Frida,False,1360.0
5626,2002,2003,75,COSTUME DESIGN,Sandy Powell,Gangs of New York,False,3131.0
5627,2002,2003,75,COSTUME DESIGN,Ann Roth,The Hours,False,590.0
5628,2002,2003,75,COSTUME DESIGN,Anna Sheppard,The Pianist,False,423.0
5629,2002,2003,75,BEST DIRECTOR,Rob Marshall,Chicago,False,1574.0
5630,2002,2003,75,BEST DIRECTOR,Martin Scorsese,Gangs of New York,False,3131.0
5631,2002,2003,75,BEST DIRECTOR,Stephen Daldry,The Hours,False,590.0
5632,2002,2003,75,BEST DIRECTOR,Roman Polanski,The Pianist,True,423.0
5633,2002,2003,75,BEST DIRECTOR,Pedro Almodóvar,Talk to Her,False,64.0
5634,2002,2003,75,FILM EDITING,Martin Walsh,Chicago,True,1574.0
5635,2002,2003,75,FILM EDITING,Thelma Schoonmaker,Gangs of New York,False,3131.0
5636,2002,2003,75,FILM EDITING,Peter Boyle,The Hours,False,590.0
5637,2002,2003,75,FILM EDITING,Michael Horton,The Lord of the Rings: The Two Towers,False,121.0
5638,2002,2003,75,FILM EDITING,Hervé de Luze,The Pianist,False,423.0
5639,2002,2003,75,FOREIGN FILM,Mexico,El Crimen del Padre Amaro,False,542.0
5640,2002,2003,75,FOREIGN FILM,People's Republic of China,Hero,False,79.0
5641,2002,2003,75,FOREIGN FILM,Finland,The Man without a Past,False,7294.0
5642,2002,2003,75,FOREIGN FILM,Germany,Nowhere in Africa,True,1591.0
5643,2002,2003,75,FOREIGN FILM,The Netherlands,Zus & Zo,False,16539.0
5644,2002,2003,75,MAKEUP AND HAIRSTYLING,"John Jackson, Beatrice De Alba",Frida,True,1360.0
5645,2002,2003,75,MAKEUP AND HAIRSTYLING,"John M. Elliott, Jr., Barbara Lorenz",The Time Machine,False,2135.0
5646,2002,2003,75,BEST SCORE,John Williams,Catch Me If You Can,False,640.0
5647,2002,2003,75,BEST SCORE,Elmer Bernstein,Far from Heaven,False,10712.0
5648,2002,2003,75,BEST SCORE,Elliot Goldenthal,Frida,True,1360.0
5649,2002,2003,75,BEST SCORE,Philip Glass,The Hours,False,590.0
5650,2002,2003,75,BEST SCORE,Thomas Newman,Road to Perdition,False,4147.0
5651,2002,2003,75,BEST SONG,Music by Elliot Goldenthal; Lyric by Julie Taymor,Frida,False,1360.0
5652,2002,2003,75,BEST SONG,Music and Lyric by Paul Simon,The Wild Thornberrys Movie,False,14317.0
5653,2002,2003,75,BEST SONG,"Music and Lyric by Bono, The Edge, Adam Clayton and Larry Mullen",Gangs of New York,False,3131.0
5654,2002,2003,75,BEST SONG,Music by John Kander; Lyric by Fred Ebb,Chicago,False,1574.0
5655,2002,2003,75,BEST SONG,"Music by Eminem, Jeff Bass and Luis Resto; Lyric by Eminem",8 Mile,True,65.0
5656,2002,2003,75,BEST PICTURE,"Martin Richards, Producer",Chicago,True,1574.0
5657,2002,2003,75,BEST PICTURE,"Alberto Grimaldi and Harvey Weinstein, Producers",Gangs of New York,False,3131.0
5658,2002,2003,75,BEST PICTURE,"Scott Rudin and Robert Fox, Producers",The Hours,False,590.0
5659,2002,2003,75,BEST PICTURE,"Barrie M. Osborne, Fran Walsh and Peter Jackson, Producers",The Lord of the Rings: The Two Towers,False,121.0
5660,2002,2003,75,BEST PICTURE,"Roman Polanski, Robert Benmussa and Alain Sarde, Producers",The Pianist,False,423.0
5661,2002,2003,75,BEST SOUND,"Michael Minkler, Dominick Tavella, David Lee",Chicago,True,1574.0
5662,2002,2003,75,BEST SOUND,"Tom Fleischman, Eugene Gearty, Ivan Sharrock",Gangs of New York,False,3131.0
5663,2002,2003,75,BEST SOUND,"Christopher Boyes, Michael Semanick, Michael Hedges, Hammond Peek",The Lord of the Rings: The Two Towers,False,121.0
5664,2002,2003,75,BEST SOUND,"Scott Millan, Bob Beemer, John Patrick Pritchett",Road to Perdition,False,4147.0
5665,2002,2003,75,BEST SOUND,"Kevin O'Connell, Greg P. Russell, Ed Novick",Spider-Man,False,557.0
5666,2002,2003,75,BEST SOUND,"Ethan Van der Ryn, Michael Hopkins",The Lord of the Rings: The Two Towers,True,121.0
5667,2002,2003,75,BEST SOUND,"Richard Hymns, Gary Rydstrom",Minority Report,False,180.0
5668,2002,2003,75,BEST SOUND,Scott A. Hecker,Road to Perdition,False,4147.0
5669,2002,2003,75,VISUAL EFFECTS,"Jim Rygiel, Joe Letteri, Randall William Cook, Alex Funke",The Lord of the Rings: The Two Towers,True,121.0
5670,2002,2003,75,VISUAL EFFECTS,"John Dykstra, Scott Stokdyk, Anthony LaMolinara, John Frazier",Spider-Man,False,557.0
5671,2002,2003,75,VISUAL EFFECTS,"Rob Coleman, Pablo Helman, John Knoll, Ben Snow",Star Wars Episode II Attack of the Clones,False,1894.0
